{
  "meta": {
    "genre": "parkour",
    "template_version": "2.0",
    "session_id": "",
    "display_name": "K12 无尽跑酷"
  },
  "core_locked": true,
  "tuning": {
    "runner": {
      "speed": 300,
      "speed_accel": 5
    },
    "jump": {
      "velocity": -760,
      "max_fall_speed": 900
    },
    "physics": {
      "gravity": 1500
    },
    "obstacle": {
      "min_gap_ms": 2000,
      "max_gap_ms": 4000
    },
    "collectible": {
      "min_gap_ms": 1500,
      "max_gap_ms": 3500
    },
    "skills": {
      "invincible": {
        "duration_ms": 5000
      },
      "double_coin": {
        "duration_ms": 8000
      },
      "double_jump": {
        "cooldown_scale": 1.0
      },
      "slide": {
        "cooldown_scale": 1.0
      }
    },
    "enabled_skills": []
  },
  "theme": {
    "asset_pack": "pixel-adventure-1",
    "player_idle": "res://assets/pixel_adventure/mask_dude/char_idle.png",
    "player_run": "res://assets/pixel_adventure/mask_dude/char_run.png",
    "player_jump": "res://assets/pixel_adventure/mask_dude/char_jump.png",
    "player_fall": "res://assets/pixel_adventure/mask_dude/char_fall.png",
    "player_hit": "res://assets/pixel_adventure/mask_dude/char_hit.png",
    "background_color": "#87ceeb",
    "title": "K12 无尽跑酷",
    "sounds": {
      "interface": {
        "click": "res://assets/kenney/interface-sounds/Audio/click_001.ogg",
        "confirm": "res://assets/kenney/interface-sounds/Audio/confirmation_001.ogg",
        "back": "res://assets/kenney/interface-sounds/Audio/back_001.ogg",
        "error": "res://assets/kenney/interface-sounds/Audio/error_001.ogg",
        "select": "res://assets/kenney/interface-sounds/Audio/select_001.ogg"
      },
      "impact": {
        "hit": "res://assets/kenney/impact-sounds/Audio/impactGeneric_light_000.ogg",
        "jump": "res://assets/kenney/impact-sounds/Audio/footstep_grass_000.ogg",
        "collect": "res://assets/kenney/impact-sounds/Audio/impactBell_heavy_000.ogg"
      }
    }
  },
  "content_safety": {
    "max_violence_level": 0,
    "max_keys": 3
  }
}
