{
  "meta": {
    "genre": "racing",
    "template_version": "1.0",
    "session_id": "",
    "display_name": "K12 欢乐赛车"
  },
  "core_locked": true,
  "tuning": {
    "render": {
      "mode": "topdown",
      "viewport_width": 540,
      "viewport_height": 960
    },
    "physics": {
      "mode": "arcade",
      "collision_mode": "slow_on_hit"
    },
    "car": {
      "max_speed": 800,
      "acceleration": 300,
      "friction": 200,
      "turn_speed": 300,
      "hit_cooldown_ms": 500,
      "npc_hit_severity": 0.4,
      "obstacle_hit_severity": 0.1,
      "off_track_severity": 0.7,
      "sprite_scale": 0.14
    },
    "track": {
      "lap_distance_px": 10000,
      "margin_px": 50,
      "atlas_crop_left_ratio": 0.38
    },
    "spawn": {
      "base_delay_ms": 2000,
      "min_delay_ms": 500,
      "delay_per_lap_ms": 200,
      "obstacle_chance_after_lap1": 0.4,
      "npc_speed_min": 200,
      "npc_speed_max_base": 400,
      "npc_speed_per_lap": 20,
      "lateral_after_lap": 2,
      "lateral_speed_max": 100
    },
    "round": {
      "duration_sec": 90
    },
    "enabled_skills": [],
    "skills": {
      "boost": {
        "cooldown_scale": 1.0
      },
      "drift_snap": {
        "cooldown_scale": 1.0
      }
    }
  },
  "theme": {
    "asset_pack": "cars-racing",
    "player_sprite": "res://assets/cars-racing/cars/png/car_17_v3_440x680.png",
    "npc_yellow_sprite": "res://assets/cars-racing/cars/png/car_10_440x680.png",
    "npc_blue_sprite": "res://assets/cars-racing/cars/png/car_23_440x680.png",
    "track_atlas": "res://assets/cars-racing/atlas/png/atlas_01_color2_2048x2048.png",
    "background_color": "#87CEEB",
    "title": "K12 欢乐赛车",
    "sounds": {
      "interface": {
        "click": "res://assets/kenney/interface-sounds/Audio/click_001.ogg",
        "confirm": "res://assets/kenney/interface-sounds/Audio/confirmation_001.ogg",
        "back": "res://assets/kenney/interface-sounds/Audio/back_001.ogg",
        "error": "res://assets/kenney/interface-sounds/Audio/error_001.ogg",
        "select": "res://assets/kenney/interface-sounds/Audio/select_001.ogg"
      },
      "impact": {
        "crash": "res://assets/kenney/impact-sounds/Audio/impactMetal_heavy_000.ogg",
        "pass": "res://assets/kenney/impact-sounds/Audio/impactBell_heavy_000.ogg"
      }
    }
  },
  "content_safety": {
    "max_violence_level": 0,
    "max_keys": 3
  }
}
