{
  "meta": {
    "genre": "survivor",
    "template_version": "1.0",
    "session_id": "",
    "display_name": "K12 割草幸存者"
  },
  "core_locked": true,
  "tuning": {
    "session": {
      "duration_sec": 180
    },
    "world": {
      "width": 3000,
      "height": 3000,
      "grid_step": 100,
      "margin": 32,
      "camera_zoom": 0.58
    },
    "player": {
      "speed": 150,
      "max_hp": 100
    },
    "weapon": {
      "base_damage": 10,
      "interval_ms": 500,
      "projectile_speed": 400,
      "multishot_base": 1,
      "spread_deg": 12
    },
    "enemy": {
      "base_hp": 10,
      "speed_min": 50,
      "speed_max": 80,
      "contact_damage": 5
    },
    "spawn": {
      "interval_ms": 4000,
      "ring_min": 520,
      "ring_max": 680,
      "max_alive": 45
    },
    "xp": {
      "gem_value": 30,
      "magnet_range": 64,
      "level_threshold_base": 100,
      "level_threshold_scale": 1.5
    },
    "level": {
      "up_choice_count": 3,
      "enemy_scale_from_level": 4,
      "enemy_speed_bonus_per_level": 0.05,
      "enemy_hp_bonus_per_level": 0.05
    },
    "boss": {
      "hp": 5000,
      "speed": 40,
      "bullet_interval_ms": 1500,
      "bullet_damage": 10,
      "bullet_speed": 200,
      "summon_interval_ms": 5000,
      "summon_count": 3,
      "laser_cooldown_sec": 3.0,
      "laser_aim_sec": 1.0,
      "laser_fire_sec": 0.5,
      "laser_damage": 30,
      "orb_interval_sec": 5.0,
      "orb_lifetime_sec": 5.0,
      "orb_speed_ratio": 0.7,
      "orb_count": 12,
      "orb_damage": 8
    },
    "win": {
      "mode": "boss"
    },
    "enabled_skills": [],
    "skills": {
      "magnet": {
        "cooldown_scale": 1.0
      },
      "nova": {
        "cooldown_scale": 1.0
      }
    }
  },
  "theme": {
    "asset_pack": "topdown-shooter",
    "player_sprite": "res://assets/kenney/topdown/PNG/Survivor 1/survivor1_stand.png",
    "enemy_sprite": "res://assets/kenney/topdown/PNG/Zombie 1/zoimbie1_stand.png",
    "enemy_sprites": [
      "res://assets/kenney/topdown/PNG/Zombie 1/zoimbie1_stand.png",
      "res://assets/kenney/topdown/PNG/Robot 1/robot1_stand.png",
      "res://assets/kenney/topdown/PNG/Soldier 1/soldier1_stand.png"
    ],
    "boss_sprite": "res://assets/kenney/topdown/PNG/Robot 1/robot1_stand.png",
    "xp_gem_sprite": "res://assets/kenney/roguelike/Tiles/Colored/tile_0118.png",
    "projectile_sprite": "",
    "background_color": "#FDFBF7",
    "title": "K12 割草幸存者",
    "sounds": {
      "interface": {
        "click": "res://assets/kenney/interface-sounds/Audio/click_001.ogg",
        "confirm": "res://assets/kenney/interface-sounds/Audio/confirmation_001.ogg",
        "back": "res://assets/kenney/interface-sounds/Audio/back_001.ogg",
        "error": "res://assets/kenney/interface-sounds/Audio/error_001.ogg",
        "select": "res://assets/kenney/interface-sounds/Audio/select_001.ogg"
      },
      "impact": {
        "shoot": "res://assets/kenney/impact-sounds/Audio/impactGeneric_light_000.ogg",
        "hit": "res://assets/kenney/impact-sounds/Audio/impactSoft_medium_000.ogg",
        "collect": "res://assets/kenney/impact-sounds/Audio/impactSoft_light_000.ogg"
      }
    }
  },
  "content_safety": {
    "max_violence_level": 0,
    "max_keys": 3
  }
}
