{
  "meta": {
    "genre": "platformer",
    "template_version": "2.0",
    "session_id": "",
    "display_name": "马里奥风格横版闯关游戏"
  },
  "core_locked": true,
  "tuning": {
    "player": {
      "move_speed": 200,
      "jump_velocity": -400,
      "max_fall_speed": 650
    },
    "physics": {
      "gravity": 800
    },
    "level": {
      "scene": "res://scenes/level_01.tscn",
      "width_multiplier": 3,
      "floor_y": 328,
      "death_y": 420
    },
    "lives": {
      "max": 3,
      "invincible_sec": 1.5
    },
    "scoring": {
      "coin": 10,
      "enemy_stomp": 100,
      "goal": 500
    },
    "enemy": {
      "patrol_speed": 50,
      "bounce_on_stomp": -300
    },
    "enemy_types": {
      "tough": {
        "stomp_hits": 2,
        "stun_sec": 0.6
      },
      "jumper": {
        "speed_mult": 0.5,
        "jump_mult": 0.8,
        "jump_interval": 2.2
      },
      "turret": {
        "fire_interval": 2.5,
        "orb_speed": 80,
        "orb_lifetime": 5.0
      }
    },
    "enabled_skills": [],
    "skills": {
      "double_jump": {
        "cooldown_scale": 1.0
      },
      "ground_pound": {
        "cooldown_scale": 1.0
      }
    }
  },
  "theme": {
    "asset_pack": "pixel-adventure-1",
    "player_idle": "res://assets/pixel_adventure/Main Characters/Mask Dude/Idle (32x32).png",
    "player_run": "res://assets/pixel_adventure/Main Characters/Mask Dude/Run (32x32).png",
    "player_jump": "res://assets/pixel_adventure/Main Characters/Mask Dude/Jump (32x32).png",
    "player_fall": "res://assets/pixel_adventure/Main Characters/Mask Dude/Fall (32x32).png",
    "player_hit": "res://assets/pixel_adventure/Main Characters/Mask Dude/Hit (32x32).png",
    "coin_spin": "res://assets/pixel_adventure/Items/Fruits/Cherries.png",
    "coin_collected": "res://assets/pixel_adventure/Items/Fruits/Collected.png",
    "box_idle": "res://assets/pixel_adventure/Items/Boxes/Box1/Idle.png",
    "box_hit": "res://assets/pixel_adventure/Items/Boxes/Box1/Hit (28x24).png",
    "box_break": "res://assets/pixel_adventure/Items/Boxes/Box1/Break.png",
    "goal_idle": "res://assets/pixel_adventure/Items/Checkpoints/End/End (Idle).png",
    "goal_pressed": "res://assets/pixel_adventure/Items/Checkpoints/End/End (Pressed) (64x64).png",
    "background_sprite": "res://assets/pixel_adventure/Background/Blue.png",
    "ground_sprite": "",
    "platform_sprite": "",
    "enemy_sprite": "",
    "title": "马里奥风格横版闯关游戏",
    "sounds": {
      "interface": {
        "click": "res://assets/kenney/interface-sounds/Audio/click_001.ogg",
        "confirm": "res://assets/kenney/interface-sounds/Audio/confirmation_001.ogg",
        "back": "res://assets/kenney/interface-sounds/Audio/back_001.ogg",
        "error": "res://assets/kenney/interface-sounds/Audio/error_001.ogg",
        "select": "res://assets/kenney/interface-sounds/Audio/select_001.ogg"
      },
      "impact": {
        "hit": "res://assets/kenney/impact-sounds/Audio/impactGeneric_light_000.ogg",
        "collect": "res://assets/kenney/impact-sounds/Audio/impactBell_heavy_000.ogg",
        "jump": "res://assets/kenney/impact-sounds/Audio/footstep_grass_000.ogg"
      }
    }
  },
  "content_safety": {
    "max_violence_level": 0,
    "max_keys": 3
  }
}
